Link,Title,Location,Summary
https://www.saramin.co.kr/zf_user/jobs/relay/view?isMypage=no&rec_idx=47388645,반도체 전략 및 기업개발 SCD 시니어 디렉터까지,경기성남시 분당구,"사업기획, 전략기획, 신사업기획, 기획, CEO 외 등록일 24/01/16"
https://www.saramin.co.kr/zf_user/jobs/relay/view?isMypage=no&rec_idx=47394252,MX Senior Account Manager,경기성남시 분당구,"기술영업, IT영업, 유통영업, 회로설계, 반도체 외 등록일 24/01/17"
https://www.saramin.co.kr/zf_user/jobs/relay/view?isMypage=no&rec_idx=47375958,[CREVERSE] Full-time or Short-term English Teaching Position,서울강남구,"원어민강사, 학원강사, 영어, 어학원, 영어학원 외 수정일 24/01/15"
https://www.saramin.co.kr/zf_user/jobs/relay/view?isMypage=no&rec_idx=47380823,[외국계법인] SCM Assistant Manager 신입,서울강남구,"경영지원, 무역사무원, 글로벌마케팅, SCM, 문서작성 외 등록일 24/01/16"
https://www.saramin.co.kr/zf_user/jobs/relay/view?isMypage=no&rec_idx=47340105,"경력직 공무 관리자 - 설비 보전, 전기(전기기사, 전기산업기사)",충남논산시,"공무, 설비보수, 전기기사, 기타제조업 수정일 24/01/10"
https://www.saramin.co.kr/zf_user/jobs/relay/view?isMypage=no&rec_idx=47363613,Business Development Associate,아시아·중동필리핀,"카지노, 호텔, 카지노 등록일 24/01/12"
https://www.saramin.co.kr/zf_user/jobs/relay/view?isMypage=no&rec_idx=47378454,독일계 자동차기업 [Senior Sales Planner] 과장급 채용,서울중구,"자동차딜러, 자동차매장 등록일 24/01/15"
https://www.saramin.co.kr/zf_user/jobs/relay/view?isMypage=no&rec_idx=47371258,외국계도장설비기업-컨베이어 설계 및 설비이전 엔지니어,서울구로구,"기술엔지니어, 설계엔지니어, 기계설계, 기구설계, 기술설계 외 등록일 24/01/15"
https://www.saramin.co.kr/zf_user/jobs/relay/view?isMypage=no&rec_idx=47326304,"(주)에프엔블럭 ERP 프로젝트 매니저(PM, 컨설턴트) 신입 모집",서울송파구,"IT컨설팅, 솔루션, ERP, 컨설턴트, PM(프로젝트매니저) 외 수정일 24/01/09"
https://www.saramin.co.kr/zf_user/jobs/relay/view?isMypage=no&rec_idx=47337855,[TmaxRG] 마케팅/경영기획/기술 영업 채용,경기성남시 분당구,"기술영업, 솔루션기술영업, 시스템영업, 영업마케팅, 영업전략 외 등록일 24/01/09"
https://www.saramin.co.kr/zf_user/jobs/relay/view?isMypage=no&rec_idx=47391583,20. [Entertainment] IP전략기획팀(신입/경력) 채용,서울강남구,"사업기획, 전략기획, 사업개발, 사업관리, 신사업기획 외 등록일 24/01/17"
https://www.saramin.co.kr/zf_user/jobs/relay/view?isMypage=no&rec_idx=47293475,Operation (Shipping),서울중구,"해상운송, 해상운송 수정일 24/01/03"
https://www.saramin.co.kr/zf_user/jobs/relay/view?isMypage=no&rec_idx=47096566,[독일계/자동차IT기업] 차량통신 소프트웨어 엔지니어,서울용산구,"기술지원, 솔루션, 네트워크, C#, C++ 외 등록일 23/12/01"
https://www.saramin.co.kr/zf_user/jobs/relay/view?isMypage=no&rec_idx=47146898,인천공항 ULD 수리샵 지점장 모집 공고,인천중구,"사업관리, 항공사 수정일 23/12/12"
https://www.saramin.co.kr/zf_user/jobs/relay/view?isMypage=no&rec_idx=47131355,(정규직) 국제/외국인학교 각 부문 신입/경력직 모집,서울서초구,"사무직, 면접/인터뷰, 인사행정, 경영기획, 사업기획 외 등록일 23/12/07"
https://www.saramin.co.kr/zf_user/jobs/relay/view?isMypage=no&rec_idx=47363569,International Premium Host,아시아·중동필리핀,"카지노, 호텔, 카지노 등록일 24/01/12"
https://www.saramin.co.kr/zf_user/jobs/relay/view?isMypage=no&rec_idx=47371271,외국계도장설비기업-Project Manager,서울구로구,"기술엔지니어, 기계설계, 2D설계, 3D설계, 도장/도금/도색 외 등록일 24/01/15"
https://www.saramin.co.kr/zf_user/jobs/relay/view?isMypage=no&rec_idx=47405192,탑티어 엔터사 IP사업부문 전략기획팀(3년차 이상),서울강남구,"IP(지식재산권), 사업기획, 전략기획, 사업개발, 신사업기획 외 등록일 24/01/18"
https://www.saramin.co.kr/zf_user/jobs/relay/view?isMypage=no&rec_idx=47256642,"[글로벌 제약사] Medical Advisor, Liver Disease",서울송파구,"제약/바이오, 의약·제약 등록일 23/12/28"
https://www.saramin.co.kr/zf_user/jobs/relay/view?isMypage=no&rec_idx=47259052,Regional Senior Manager of Operations and Process Innovation,서울영등포구,"SCM, 전략구매, ERP, 생명공학 수정일 23/12/28"
https://www.saramin.co.kr/zf_user/jobs/relay/view?isMypage=no&rec_idx=47038287,[TE 커넥티비티] Supply Chain Management Analyst,경북경산시,"SCM, 기계, 자동차부품 수정일 24/01/01"
https://www.saramin.co.kr/zf_user/jobs/relay/view?isMypage=no&rec_idx=47328291,자동차부품 마케팅/기술영업 모집,경기수원시 영통구,"기술영업, 영업관리, 영업직, 영업전략, 영업판촉 외 수정일 24/01/08"
https://www.saramin.co.kr/zf_user/jobs/relay/view?isMypage=no&rec_idx=47126757,Integrated Clinician/Clinical Assessor,서울종로구,"의사, 의료영상, 영상의학과, 컨설팅 수정일 24/01/09"
https://www.saramin.co.kr/zf_user/jobs/relay/view?isMypage=no&rec_idx=47217685,[자동차도장설비] 전기 엔지니어 DXQ,서울구로구,"전기기사, 전기설계, 전기설비, 건설회사 등록일 23/12/20"
https://www.saramin.co.kr/zf_user/jobs/relay/view?isMypage=no&rec_idx=47308106,[글로벌 수입자동차] 전략기획,서울중구,"경영기획, 자동차매장 수정일 24/01/05"
https://www.saramin.co.kr/zf_user/jobs/relay/view?isMypage=no&rec_idx=46836501,QA Engineer · AI Platform,서울강남구,"ECMAScript, 웹개발, 프론트엔드, DBA, QA/테스터 외 수정일 24/01/12"
https://www.saramin.co.kr/zf_user/jobs/relay/view?isMypage=no&rec_idx=47379398,라이카카메라코리아(주) Akademie & Training 팀원 모집,서울강남구,"포토그래퍼, 교수설계, 교육운영, 교육컨텐츠기획, 공연예술 외 수정일 24/01/16"
https://www.saramin.co.kr/zf_user/jobs/relay/view?isMypage=no&rec_idx=47360353,[한국스트라이커] Senior Sales Representative,서울강남구,"의료기기영업, 의료기기 수정일 24/01/12"
https://www.saramin.co.kr/zf_user/jobs/relay/view?isMypage=no&rec_idx=47360730,독일외국계 철도차량사업부 Sales Admin [정규직/경력],서울중구,"영업관리, 영업지원, 기계판매, 기계설비 수정일 24/01/12"
https://www.saramin.co.kr/zf_user/jobs/relay/view?isMypage=no&rec_idx=47384538,[존슨앤드존슨 메디칼] Invoice to Cash Accountant,서울용산구,"감사, 채권관리, 회계, 의료기기 등록일 24/01/16"
https://www.saramin.co.kr/zf_user/jobs/relay/view?isMypage=no&rec_idx=47256194,"영업관리/사무 / 매니저 (러시아어, 영어)",서울강남구,"경리, 경영지원, 국제무역사, 거래처납품, 매출관리 외 등록일 23/12/28"
https://www.saramin.co.kr/zf_user/jobs/relay/view?isMypage=no&rec_idx=47360934,[홈헬스케어] 의료장비 기술지원 엔지니어 (전북/전남/광주),광주광산구,"고객안내, 고객응대, 기계수리, 호텔, 의료기기 등록일 24/01/12"
https://www.saramin.co.kr/zf_user/jobs/relay/view?isMypage=no&rec_idx=47062866,[외국계 한국에이치비플러] 접착제 관련 영업사원 경력직 채용,경기광명시,"영업, 기술영업, 화학, 화공, 폴리머 수정일 23/11/29"
https://www.saramin.co.kr/zf_user/jobs/relay/view?isMypage=no&rec_idx=47360920,[외국계] Customer Service Representative,서울강남구,"구매관리, 물류관리, 재고관리, 물류기획, SCM 외 수정일 24/01/12"
https://www.saramin.co.kr/zf_user/jobs/relay/view?isMypage=no&rec_idx=47302347,외국계 플라스틱 제조기업 [Operation Manage/충북] 부장~이사급,충북보은군,"생산관리, 공장장, 플라스틱, 프라스틱제조, 사출·압출 등록일 24/01/04"
https://www.saramin.co.kr/zf_user/jobs/relay/view?isMypage=no&rec_idx=47335775,CEO(대표이사) 국내중견그룹 지주사,서울종로구,"CEO, 사업관리, 시장조사, 건설회사 등록일 24/01/09"
https://www.saramin.co.kr/zf_user/jobs/relay/view?isMypage=no&rec_idx=47371306,외국계도장설비기업-Wet & Booth Engineer,서울구로구,"기술엔지니어, 설계엔지니어, 기계설계, 기구설계, 기술설계 외 등록일 24/01/15"
https://www.saramin.co.kr/zf_user/jobs/relay/view?isMypage=no&rec_idx=47363671,International Premium Services Manager,아시아·중동필리핀,"카지노, 호텔, 카지노 수정일 24/01/12"
https://www.saramin.co.kr/zf_user/jobs/relay/view?isMypage=no&rec_idx=47371230,외국계도장설비기업-신입 전기설계 엔지니어,서울구로구,"기술엔지니어, 설계엔지니어, 기술설계, 자동화설계, 전기설계 외 등록일 24/01/15"
https://www.saramin.co.kr/zf_user/jobs/relay/view?isMypage=no&rec_idx=47084928,[외국계 Business Development Lead,서울종로구,"경영기획, 브랜드기획, 사업기획, 전략기획, 경영분석 외 수정일 23/12/05"
https://www.saramin.co.kr/zf_user/jobs/relay/view?isMypage=no&rec_idx=47335478,[대전]미국계 의료기기 Sales Rep./MR,대전동구,"간호사, 방사선사, 의공기사, 의료기기영업, 장비영업 외 수정일 24/01/09"
https://www.saramin.co.kr/zf_user/jobs/relay/view?isMypage=no&rec_idx=47377881,ㅣ제약 대기업ㅣ사업제휴 (주임-과장급),서울강남구,"사업제휴, 헤드헌팅 등록일 24/01/15"
https://www.saramin.co.kr/zf_user/jobs/relay/view?isMypage=no&rec_idx=47400159,외국계 반도체업체 연구소 Lab Operations Engineer,경기화성시,"디스플레이, 반도체, 반도체, LCD, 디스플레이 외 등록일 24/01/18"
https://www.saramin.co.kr/zf_user/jobs/relay/view?isMypage=no&rec_idx=47068180,세포유전자치료제 분야의 기술평가 및 사업개발,경기성남시 수정구,"생명과학, 제약/바이오, 리서치, 사업개발, 의약·제약 외 수정일 23/11/29"
https://www.saramin.co.kr/zf_user/jobs/relay/view?isMypage=no&rec_idx=47363646,International Premium Executive Host,아시아·중동필리핀,"카지노, 호텔, 카지노 등록일 24/01/12"
https://www.saramin.co.kr/zf_user/jobs/relay/view?isMypage=no&rec_idx=47274091,복지용구1위기업 (주)조아 경영관리팀 회계 신입 및 경력 채용,경기광명시,"경리, 경리사무원, 4대보험, 관리회계, 기업회계 외 수정일 24/01/18"
https://www.saramin.co.kr/zf_user/jobs/relay/view?isMypage=no&rec_idx=47371251,외국계도장설비기업-컨베이어 설계 엔지니어,서울구로구,"기술엔지니어, 설계엔지니어, 기계설계, 기구설계, 기술설계 외 등록일 24/01/15"
https://www.saramin.co.kr/zf_user/jobs/relay/view?isMypage=no&rec_idx=47395951,Senior Cloud Infrastructure Specialist,서울전체,"백엔드/서버개발, 웹개발, SE(시스템엔지니어), 인프라, DevOps 외 등록일 24/01/17"
https://www.saramin.co.kr/zf_user/jobs/relay/view?isMypage=no&rec_idx=47371242,외국계도장설비기업-전기설계 엔지니어,서울구로구,"기술엔지니어, 설계엔지니어, 기술설계, 자동화설계, 전기설계 외 등록일 24/01/15"
https://www.saramin.co.kr/zf_user/jobs/relay/view?isMypage=no&rec_idx=47387110,Corporate Development Specialist Lead(실장) 모집,서울강남구,"경영기획, 경영분석, 경영관리, 전략기획, CEO 외 수정일 24/01/16"
https://www.saramin.co.kr/zf_user/jobs/relay/view?isMypage=no&rec_idx=47125885,[특허법인 IPLAY] 스타트업의 CIPO가 되어줄 분을 찾습니다-전자,서울강남구,"변리사, 특허분석, 특허컨설팅, 법률사무소, 로펌 외 등록일 23/12/06"
https://www.saramin.co.kr/zf_user/jobs/relay/view?isMypage=no&rec_idx=47294452,BD팀 (팀원) 채용,경기용인시 수지구,"영업마케팅, 제약영업, B2B, 제약/바이오, 사업개발 외 등록일 24/01/03"
https://www.saramin.co.kr/zf_user/jobs/relay/view?isMypage=no&rec_idx=47390812,Freelance Artist and Repertoire (A&R) Manager,서울마포구,"음반기획, 엔터테인먼트, A&R, 엔터테인먼트 등록일 24/01/17"
https://www.saramin.co.kr/zf_user/jobs/relay/view?isMypage=no&rec_idx=47377324,HR Specialist (사원대리급)-글로벌 패션 브랜드 보유 기업,서울강남구,"인사기획, 인사행정, 인사, 의류·의상 등록일 24/01/15"
https://www.saramin.co.kr/zf_user/jobs/relay/view?isMypage=no&rec_idx=47026396,미국 Business Development Manager 채용,서울서초구,"영업전략, B2B, 기업영업, 바이어발굴/관리, 실적관리 외 등록일 23/11/21"
https://www.saramin.co.kr/zf_user/jobs/relay/view?isMypage=no&rec_idx=47076756,[WWF-Korea] Sustainable Finance Programme Officer 채용,서울종로구,"전략기획, 컨설턴트, 기업금융, 기업분석, 일반은행 외 등록일 23/11/29"
https://www.saramin.co.kr/zf_user/jobs/relay/view?isMypage=no&rec_idx=47403601,[존슨앤드존슨 메드테크] Sr. RA Specialist-육아휴직 대체 계약,서울용산구,"RA, 의약·제약, 의료·보건, 바이오 등록일 24/01/18"
https://www.saramin.co.kr/zf_user/jobs/relay/view?isMypage=no&rec_idx=47384599,[존슨앤드존슨 메디칼] Sr. Professional Sales Representative,서울용산구,"영업관리, 고객관리, 영업, 의약·제약, 의료·보건 외 등록일 24/01/16"
https://www.saramin.co.kr/zf_user/jobs/relay/view?isMypage=no&rec_idx=47133728,[BD Korea] Marketing Specialist (혈액학/Hematology),서울강남구,"혈액종양내과, 의료기기영업, 제약영업, 분자진단, 생명과학 외 등록일 23/12/07"
https://www.saramin.co.kr/zf_user/jobs/relay/view?isMypage=no&rec_idx=47195328,"[BD Korea] Business Development (B2B, Chronic, CDMO)",서울강남구,"솔루션기술영업, 의료기기영업, B2B, 기업영업, 바이러스 외 등록일 23/12/18"
https://www.saramin.co.kr/zf_user/jobs/relay/view?isMypage=no&rec_idx=47118114,[TE 커넥티비티] Demand Analyst,서울송파구,"데이터분석가, SAP, 자동제어 수정일 24/01/01"
https://www.saramin.co.kr/zf_user/jobs/relay/view?isMypage=no&rec_idx=47299292,[외국계 화학] 각 부문 신입/경력 채용,서울송파구,"백엔드/서버개발, 보안컨설팅, 유지보수, 정보보안, 네트워크 외 수정일 24/01/09"
https://www.saramin.co.kr/zf_user/jobs/relay/view?isMypage=no&rec_idx=47228610,[한국하니웰] 가스탐지기 세일즈 (신입가능),서울마포구,"기술영업, 건설영업, 솔루션기술영업, 시스템영업, 기업영업 외 수정일 23/12/22"
https://www.saramin.co.kr/zf_user/jobs/relay/view?isMypage=no&rec_idx=47332473,Automated Vehicle Safety Engineer,서울종로구,"인증심사원, 품질보증, 자동차, 컨설팅 등록일 24/01/09"
https://www.saramin.co.kr/zf_user/jobs/relay/view?isMypage=no&rec_idx=47354411,슈나이더일렉트릭 물류 통관 Transportation Manager,서울강서구,"통관, 물류관리, 물류사무원, 국제물류, 물류기획 외 수정일 24/01/11"
https://www.saramin.co.kr/zf_user/jobs/relay/view?isMypage=no&rec_idx=47170355,(주)트렉시 B2B팀 영업 AMD 채용,서울마포구,"영업관리, 영업지원, 매출관리, 주문관리, 구매관리 외 수정일 24/01/18"
https://www.saramin.co.kr/zf_user/jobs/relay/view?isMypage=no&rec_idx=47402853,[존슨앤드존슨 메드테크] Marketing/Sales Coordinator (계약직),서울용산구,"총무, 비품관리, 영업지원, 의약·제약, 의료·보건 외 등록일 24/01/18"
https://www.saramin.co.kr/zf_user/jobs/relay/view?isMypage=no&rec_idx=47155940,"Site Controller, Korea",서울강남구,"관리회계, 기업회계, 손익관리, 회계, 화공 수정일 23/12/14"
https://www.saramin.co.kr/zf_user/jobs/relay/view?isMypage=no&rec_idx=47355857,[메드트로닉코리아] 계약직채용 Sales Operation Specialist,서울강남구,"경영기획, 마케팅기획, 유통업, 수입유통 등록일 24/01/11"
https://www.saramin.co.kr/zf_user/jobs/relay/view?isMypage=no&rec_idx=47355806,[한국필립모리스] Manager Consumer Insights,서울영등포구,"데이터분석가, 데이터시각화, 빅데이터, 리서치, 시장조사 외 등록일 24/01/11"
https://www.saramin.co.kr/zf_user/jobs/relay/view?isMypage=no&rec_idx=47332514,Hardware Functional Safety Engineer - Automotive,서울종로구,"인증심사원, 품질보증, 자동차, 컨설팅 등록일 24/01/09"
https://www.saramin.co.kr/zf_user/jobs/relay/view?isMypage=no&rec_idx=47302420,"Solution Product Manager (마케팅:서비스,렌탈영업 경력)",서울송파구,"렌탈영업, 렌탈, 판매 등록일 24/01/04"
https://www.saramin.co.kr/zf_user/jobs/relay/view?isMypage=no&rec_idx=47306300,[한국필립모리스] Specialist Talent Acquisition(서울),서울영등포구,"채용담당자, 잡매니저, 헤드헌터, 온보딩, 인사기획 외 등록일 24/01/05"
https://www.saramin.co.kr/zf_user/jobs/relay/view?isMypage=no&rec_idx=47022060,한국이네오스스티롤루션 Account Sales Manager 채용,서울강남구,"기술영업, 영업관리, 해외영업, 영업, 기타제조업 수정일 24/01/02"
https://www.saramin.co.kr/zf_user/jobs/relay/view?isMypage=no&rec_idx=47363518,[IKEA 기흥점] 인테리어 디자인 사원 모집,경기용인시 기흥구,"공간디자인, 실내디자인, 인테리어, 가구·침구·소품 등록일 24/01/12"
https://www.saramin.co.kr/zf_user/jobs/relay/view?isMypage=no&rec_idx=47075856,[Danfoss Korea] 댄포스코리아 Application Engineer,서울중구,"기술엔지니어, 전기설계, 전기제어, 전기기사, 전기설비 외 등록일 23/11/29"
https://www.saramin.co.kr/zf_user/jobs/relay/view?isMypage=no&rec_idx=47384422,[한국얀센] Medical Science Liaison (Contractor),서울용산구,"컴플라이언스, 임상시험, 제약/바이오, R&D, MSL 외 등록일 24/01/16"
https://www.saramin.co.kr/zf_user/jobs/relay/view?isMypage=no&rec_idx=47301700,[강남/외국계기업] 마케팅/브랜딩 Specialist 채용,서울강남구,"영업직, 시스템영업, 영업마케팅, 영업전략, 마케팅기획 외 등록일 24/01/04"
https://www.saramin.co.kr/zf_user/jobs/relay/view?isMypage=no&rec_idx=47380805,[판교] GE Vernova Customer Care Specialist [1Y4M /산휴대체],경기성남시 분당구,"고객관리, 의약·제약, 의료·보건, 생명공학 등록일 24/01/16"
https://www.saramin.co.kr/zf_user/jobs/relay/view?isMypage=no&rec_idx=47380707,[판교] GE Vernova Customer Care Specialist [1Y4M /육휴대체],경기성남시 분당구,"고객관리, 의약·제약, 의료·보건, 생명공학 등록일 24/01/16"
https://www.saramin.co.kr/zf_user/jobs/relay/view?isMypage=no&rec_idx=47332529,Software Functional Safety Engineer - Automotive,서울종로구,"인증심사원, 품질보증, 자동차, 컨설팅 등록일 24/01/09"
https://www.saramin.co.kr/zf_user/jobs/relay/view?isMypage=no&rec_idx=47354629,[Michelin Guide Korea] Digital Content Editor (Freelancer),서울송파구,"에디터, 작가, 크리에이터, 마케팅기획, 콘텐츠기획 외 등록일 24/01/11"
https://www.saramin.co.kr/zf_user/jobs/relay/view?isMypage=no&rec_idx=47069546,Senior Account Manager 경력직 채용 -B2B 영업,서울송파구,"거래처관리, 거래처영업, 기업영업, 영업, B2B 외 수정일 24/01/03"
https://www.saramin.co.kr/zf_user/jobs/relay/view?isMypage=no&rec_idx=47254038,[외국계] 제조 Operation Manager (부장/이사급),충북보은군,"제조, 프라스틱제조 등록일 23/12/28"
https://www.saramin.co.kr/zf_user/jobs/relay/view?isMypage=no&rec_idx=47323602,Naval Architect with Excellence in Business Development,서울중구,"해상운송, 사업기획, 해운, 해상운송 수정일 24/01/08"
https://www.saramin.co.kr/zf_user/jobs/relay/view?isMypage=no&rec_idx=47262055,"마케팅 Product Manager, EDS (Essential Dental Solution)",서울송파구,"마케팅기획, 마케팅전략, 비즈니스마케팅, 프로덕트마케팅, 마케팅 외 등록일 23/12/29"
https://www.saramin.co.kr/zf_user/jobs/relay/view?isMypage=no&rec_idx=47404695,[도장 자동화 시스템 (로봇)] Robot Teacher (신입),울산북구,"로봇엔지니어, 로봇설계, 기술엔지니어, 기계설계, 생산 외 등록일 24/01/18"
https://www.saramin.co.kr/zf_user/jobs/relay/view?isMypage=no&rec_idx=47339355,"[티맵모빌리티] Staff 직무 채용 (구매, 전략기획, M&A, PR)",서울중구,"IPO, 기업홍보, 언론홍보, 경영기획, 사업기획 외 수정일 24/01/10"
https://www.saramin.co.kr/zf_user/jobs/relay/view?isMypage=no&rec_idx=47227828,Finance Manager,서울용산구,"회계, 재무, IFRS, 무역업 수정일 23/12/22"
https://www.saramin.co.kr/zf_user/jobs/relay/view?isMypage=no&rec_idx=47306331,[한국필립모리스] Specialist Talent Acquisition(양산),경남양산시,"채용담당자, 잡매니저, 헤드헌터, 온보딩, 인사기획 외 등록일 24/01/05"
https://www.saramin.co.kr/zf_user/jobs/relay/view?isMypage=no&rec_idx=47062596,(주)트렉시 고객 서비스팀 C/S 담당자 신입/경력직 채용,서울마포구,"CS관리, CS, 게시판관리, 교환/반품, 메일상담 외 수정일 24/01/18"
https://www.saramin.co.kr/zf_user/jobs/relay/view?isMypage=no&rec_idx=47377898,외국계 의료기- QA/RA(대리/과장),서울강남구,"RA, 의약·제약, 의료·보건 등록일 24/01/15"
https://www.saramin.co.kr/zf_user/jobs/relay/view?isMypage=no&rec_idx=47399179,컨슈머헬스 사업부 RA Associate (육휴대체 20개월 계약직),서울영등포구,"인/허가, 약사, RA, 생명과학, 의약외품연구 외 수정일 24/01/18"
https://www.saramin.co.kr/zf_user/jobs/relay/view?isMypage=no&rec_idx=47404154,[메드트로닉코리아] 계약직 Assoc Marketing Specialist,서울강남구,"의료기기영업, 마케팅기획, 마케팅전략, 기업홍보, 디지털마케팅 외 수정일 24/01/18"
https://www.saramin.co.kr/zf_user/jobs/relay/view?isMypage=no&rec_idx=47371292,외국계도장설비기업-Process Engineer,서울구로구,"기술엔지니어, 설계엔지니어, 공정설계, 기계설계, 자동화설계 외 등록일 24/01/15"
https://www.saramin.co.kr/zf_user/jobs/relay/view?isMypage=no&rec_idx=44519382,[Poker] Project Manager for Development,서울강남구,"PL(프로젝트리더), PM(프로젝트매니저), PMO, PO(프로덕트오너), 소프트웨어개발 수정일 24/01/12"
https://www.saramin.co.kr/zf_user/jobs/relay/view?isMypage=no&rec_idx=47354450,인비절라인코리아 (iTero) Sales Support Administrator 채용,서울강남구,"영업지원, 판매 등록일 24/01/11"
https://www.saramin.co.kr/zf_user/jobs/relay/view?isMypage=no&rec_idx=47375083,[노벨리스] 구매팀 신입 채용(영주 근무),경북영주시,"구매관리, 구매기획, 개발구매, 거래처관리, 구매 외 등록일 24/01/15"
https://www.saramin.co.kr/zf_user/jobs/relay/view?isMypage=no&rec_idx=47019808,"Application Engineer (신입, 경력)",서울영등포구,"정보통신, R&D, 전자제어, R, 통신 외 수정일 23/11/22"
https://www.saramin.co.kr/zf_user/jobs/relay/view?isMypage=no&rec_idx=47272808,국내 세일즈 영업 경력직 모집 [외국계회사],서울강남구,"기술영업, 영업직, 네트워크영업, 해외영업, IT영업 외 수정일 24/01/02"
https://www.saramin.co.kr/zf_user/jobs/relay/view?isMypage=no&rec_idx=47332303,[홈헬스케어] 서울/경기 의료장비 기술지원 엔지니어 (신입가능),서울송파구,"고객안내, 고객응대, 기계수리, 의료기기 등록일 24/01/09"
https://www.saramin.co.kr/zf_user/jobs/relay/view?isMypage=no&rec_idx=47310282,[외국계 솔루션] 해외영업 (기술) 신입/경력 채용,서울서초구,"기술영업, 해외영업, 영업, 솔루션업체, 소프트웨어개발 등록일 24/01/05"
https://www.saramin.co.kr/zf_user/jobs/relay/view?isMypage=no&rec_idx=47178987,Service Planner/Scheduler 43006 Field Operations Dispatcher,강원평창군,"기획, 환경 수정일 24/01/10"
https://www.saramin.co.kr/zf_user/jobs/relay/view?isMypage=no&rec_idx=47073955,[카고파트너코리아] 외국계포워딩 영업사원을 모십니다.,서울강서구,"항공운송, 포워더, 물류관리, 영업, 고객관리 외 등록일 23/11/29"
https://www.saramin.co.kr/zf_user/jobs/relay/view?isMypage=no&rec_idx=47042832,[외국계 제약] 정규직 마케팅 Product Manager,서울강남구,"제약영업, 마케팅기획, 마케팅전략, 프로덕트마케팅, 마케팅 외 등록일 23/11/23"
https://www.saramin.co.kr/zf_user/jobs/relay/view?isMypage=no&rec_idx=47403239,하이온넷(주) 웹 마케팅 업무 담당자 모집 [정규직],서울구로구,"블로그마케팅, SNS마케팅, 온라인마케팅, 검색광고, 키워드광고 외 수정일 24/01/18"
https://www.saramin.co.kr/zf_user/jobs/relay/view?isMypage=no&rec_idx=47173546,[Maersk Contract Logistics] 3PL Account Manager,서울강남구,"물류관리, 재고관리, 창고관리, 물류기획, 유통관리 외 수정일 23/12/22"
https://www.saramin.co.kr/zf_user/jobs/relay/view?isMypage=no&rec_idx=47352315,IDC 기술지원 엔지니어 모집 [정규직],서울구로구,"기술지원, SE(시스템엔지니어), 네트워크, 방화벽, 정보통신 외 등록일 24/01/11"
https://www.saramin.co.kr/zf_user/jobs/relay/view?isMypage=no&rec_idx=47356457,[수입코스메틱브랜드] Account Manager(5-7년차),서울강남구,"기획MD, 리테일MD, 바잉MD, 브랜드MD, 유통MD 외 등록일 24/01/11"
https://www.saramin.co.kr/zf_user/jobs/relay/view?isMypage=no&rec_idx=47294334,[랩도쿠] 컨텐츠 담당자 채용,서울강남구,"촬영감독, 콘텐츠기획, 콘텐츠에디터, 콘텐츠디자인, 조명 외 등록일 24/01/03"
