Link,Title,Location,Summary
https://www.saramin.co.kr/zf_user/jobs/relay/view?isMypage=no&rec_idx=47311880,[홈헬스케어] 부산 의료장비 기술지원 엔지니어 (신입가능),부산북구,"고객안내, 고객응대, 기계수리, 의료기기 수정일 24/01/08"
https://www.saramin.co.kr/zf_user/jobs/relay/view?isMypage=no&rec_idx=47262373,화평법 화관법 컨설턴트 신입 채용 (졸업예정자),서울중구,"컨설턴트, 지속가능경영, ESG, BPR, 화학물질 외 등록일 23/12/29"
https://www.saramin.co.kr/zf_user/jobs/relay/view?isMypage=no&rec_idx=47388705,외국계 스포츠 패션회사 - FP&A Manager,서울강남구,"재무, 재무기획, 헤드헌팅 등록일 24/01/16"
https://www.saramin.co.kr/zf_user/jobs/relay/view?isMypage=no&rec_idx=47361501,[중견제약그룹사] 바이오사업부 / 밸리데이션팀,충북제천시,"해외시장개척, 제약/바이오, QA, 공정설계, 기술기획 외 등록일 24/01/12"
https://www.saramin.co.kr/zf_user/jobs/relay/view?isMypage=no&rec_idx=47175963,[YG PLUS] IP Strategy그룹: IP 전략기획팀(신입/경력),서울영등포구,"사업기획, 전략기획, CEO, 기획, 인큐베이팅 외 수정일 23/12/14"
https://www.saramin.co.kr/zf_user/jobs/relay/view?isMypage=no&rec_idx=47256339,[Trip.com Group] Marketing Campaign Specialist,서울종로구,"광고캠페인, 여행사 수정일 24/01/03"
https://www.saramin.co.kr/zf_user/jobs/relay/view?isMypage=no&rec_idx=47381723,[MaxMara] MD Assistant Mgr.~Mgr. (Childcare Leave Backup),서울강남구,"기획MD, 수입유통 수정일 24/01/17"
https://www.saramin.co.kr/zf_user/jobs/relay/view?isMypage=no&rec_idx=47311557,(주)하이온넷 자사 서비스 고객 상담,서울구로구,"기술지원, SE(시스템엔지니어), 네트워크, 방화벽, 정보통신 외 등록일 24/01/05"
https://www.saramin.co.kr/zf_user/jobs/relay/view?isMypage=no&rec_idx=47281033,"마케팅 Product Manager, OAS(Suresmile) & Equipment",서울송파구,"마케팅기획, 마케팅전략, 비즈니스마케팅, 프로덕트마케팅, 마케팅 외 수정일 24/01/11"
https://www.saramin.co.kr/zf_user/jobs/relay/view?isMypage=no&rec_idx=47270790,네트워크 보안 기술지원 엔지니어 모집 [정규직],서울구로구,"기술지원, SE(시스템엔지니어), 네트워크, 방화벽, 정보통신 외 등록일 24/01/02"
